{
  "schema_version": "0.1.0",
  "record_id": "PO-143159",
  "run_id": "RUN-143159",
  "timestamp": "2026-02-04T14:31:59.518571Z",
  "node_id": "Q000011",
  "probe_id": "P-PRB-006",
  "discriminator_ids": [
    "D-011-001",
    "D-012-001"
  ],
  "interface_variables": [
    "primitive budget / silent premise"
  ],
  "chart_mode": "CHART-003",
  "observable_values": {
    "chart_mode_id": "CHART-003",
    "inputs_summary": {
      "probe_id": "P-PRB-006",
      "chart_mode_id": "CHART-003",
      "stub_mode": true,
      "input_fields": [
        "node_ids",
        "role_assignment_mappings",
        "chart_variants"
      ],
      "seed": 1,
      "inputs": {}
    },
    "outputs": {
      "score": 0.9,
      "pass_fail": "pass",
      "seam_count": 0
    },
    "seam_flags": [],
    "pass_fail": "pass"
  },
  "split_result": "pass",
  "confidence": 0.9,
  "failure_signatures": [],
  "notes": "A9.3 stub execution"
}
